{
  "contract_version": "s3.human_subject.output.v1",
  "operator_name": "human_subject_extractor",
  "job_id": "realrun_supervisor_005",
  "video_id": "realcheck_video_005",
  "account_id": "006",
  "language": "pt-BR",
  "status": "completed",
  "entities": [
    {
      "entity_id": "hs_001",
      "entity_type": "person",
      "canonical_label": "Luís XIV",
      "aliases": ["o Rei Sol"],
      "scene_ids": ["scene_001", "scene_003"],
      "specificity_level": "high",
      "visual_relevance_note": "Figura central identificável que percorre Versalhes e cuja morte desencadeia o vazio político.",
      "source_confidence": "high"
    },
    {
      "entity_id": "hs_002",
      "entity_type": "person",
      "canonical_label": "Madame de Maintenon",
      "aliases": [],
      "scene_ids": ["scene_002"],
      "specificity_level": "high",
      "visual_relevance_note": "Companheira do rei durante a cerimônia privada, explicitamente nomeada no texto.",
      "source_confidence": "high"
    },
    {
      "entity_id": "hs_003",
      "entity_type": "group",
      "canonical_label": "cortesãos",
      "aliases": ["membros da corte"],
      "scene_ids": ["scene_001", "scene_002"],
      "specificity_level": "medium",
      "visual_relevance_note": "Grupo observador e de fundo que presencia a caminhada do rei e aguarda na cerimônia.",
      "source_confidence": "high"
    },
    {
      "entity_id": "hs_004",
      "entity_type": "group",
      "canonical_label": "nobres",
      "aliases": [],
      "scene_ids": ["scene_003"],
      "specificity_level": "medium",
      "visual_relevance_note": "Grupo de discussão política após a morte do rei.",
      "source_confidence": "high"
    }
  ],
  "warnings": [
    "Operator agent could not be invoked because ACP runtime backend is not configured in this environment; output was produced by supervisor fallback for validation continuity."
  ],
  "generated_at": "2026-04-03T16:30:00+00:00"
}